{
  "simulationId": "ba201-sim-meridian-health-01",
  "title": "The Meridian Health Salesforce Rollout",
  "certification": "BA-201",
  "version": "1.0.0",
  "description": "You are the Business Analyst on a full Salesforce implementation for Meridian Health, a mid-sized regional clinic network. Walk the entire project lifecycle \u2014 from your first discovery interview to go-live \u2014 making the calls a real BA would make. Your decisions shape stakeholder trust, project health, and schedule risk all the way to the end.",
  "estimatedMinutes": 60,
  "startScene": "s01_kickoff",
  "domains": [
    {
      "id": "d1",
      "label": "Customer Discovery",
      "weight": "17%"
    },
    {
      "id": "d2",
      "label": "Collaboration with Stakeholders",
      "weight": "23%"
    },
    {
      "id": "d3",
      "label": "Business Process Mapping",
      "weight": "12%"
    },
    {
      "id": "d4",
      "label": "Requirements",
      "weight": "18%"
    },
    {
      "id": "d5",
      "label": "User Stories",
      "weight": "18%"
    },
    {
      "id": "d6",
      "label": "Development Support & UAT",
      "weight": "12%"
    }
  ],
  "initialState": {
    "projectHealth": 100,
    "stakeholderTrust": 100,
    "scheduleRisk": 0
  },
  "scenes": [
    {
      "id": "s01_kickoff",
      "domainId": "d1",
      "narrative": "Week 1. You've just joined the Meridian Health Salesforce project as the Business Analyst. The CIO's project brief is one sentence: **'Fix our broken patient intake process.'** In your first stakeholder interview, the Intake Director walks you through intake \u2014 then, almost as an aside, mentions: *'Honestly, intake annoys people, but scheduling is what actually causes us to lose patients. We get double-bookings every single week.'* This wasn't mentioned anywhere in the original brief.",
      "characterContext": {
        "speakingAs": "Renata Diaz",
        "role": "Intake Director"
      },
      "decision": {
        "prompt": "What do you do with this finding?",
        "options": [
          {
            "id": "A",
            "text": "Document it as a confirmed requirement and start designing a scheduling fix right away \u2014 no need to slow things down.",
            "isCorrect": false,
            "feedback": "Too fast. You've converted an unvalidated, single-source comment directly into a requirement and skipped the sponsor entirely.",
            "stateChanges": {
              "projectHealth": -6,
              "scheduleRisk": 10
            },
            "setFlags": [
              "skipped_validation"
            ],
            "nextScene": "s02b_pushback"
          },
          {
            "id": "B",
            "text": "Note it as a discovery finding, and raise it with the CIO to assess whether scheduling should be part of this project's scope.",
            "isCorrect": true,
            "feedback": "Correct instinct. You're capturing a real signal without unilaterally expanding scope.",
            "stateChanges": {
              "projectHealth": 2,
              "stakeholderTrust": 2
            },
            "setFlags": [
              "validated_scope_early"
            ],
            "nextScene": "s02a_cio_response"
          },
          {
            "id": "C",
            "text": "Thank her for the input, but stick strictly to intake since that's what the brief says.",
            "isCorrect": false,
            "feedback": "You may be ignoring the organization's actual top pain point because it wasn't in a one-sentence brief.",
            "stateChanges": {
              "projectHealth": -7,
              "stakeholderTrust": -4
            },
            "setFlags": [
              "ignored_signal"
            ],
            "nextScene": "s02b_pushback"
          }
        ]
      },
      "explanation": "**Customer Discovery is about uncovering the real problem, not just executing the stated one.** A one-line brief from an executive is almost never the full picture \u2014 operational staff often reveal the real pain points once you start asking questions. The correct move is neither to silently expand scope (A) nor to ignore new signals (C), but to surface the finding to the person with scoping authority (the CIO) and let them make an informed call. This protects both the project's governance and its relevance to what the business actually needs."
    },
    {
      "id": "s02b_pushback",
      "domainId": "d1",
      "isDetour": true,
      "narrative": "Two weeks later, the CIO emails you, copying her boss: *'Why am I hearing from three different directors that we're now \"looking at scheduling\"? That's not what we agreed to scope. I need this back on track.'* You've lost some trust before discovery is even finished.",
      "decision": {
        "prompt": "How do you respond?",
        "options": [
          {
            "id": "A",
            "text": "Apologize, explain transparently what happened (a real signal surfaced, but you should have routed it through her first), and propose a quick scoping conversation now.",
            "isCorrect": true,
            "feedback": "Good recovery. Owning the process gap and proposing a concrete fix rebuilds credibility faster than defending the decision.",
            "stateChanges": {
              "stakeholderTrust": 2,
              "projectHealth": 1
            },
            "nextScene": "s03_data_landscape"
          },
          {
            "id": "B",
            "text": "Defend the decision \u2014 the scheduling issue is clearly important, so raising it was the right call regardless of process.",
            "isCorrect": false,
            "feedback": "Being right about the finding doesn't excuse bypassing the governance process \u2014 this will read as defensiveness, not accountability.",
            "stateChanges": {
              "stakeholderTrust": -3
            },
            "nextScene": "s03_data_landscape"
          }
        ]
      },
      "explanation": "**When a process misstep damages trust, the fastest repair is transparent ownership plus a concrete next step** \u2014 not re-litigating whether the underlying finding was valid. The CIO's frustration is about being bypassed, not about whether scheduling matters. Address the actual complaint first."
    },
    {
      "id": "s02a_cio_response",
      "domainId": "d1",
      "narrative": "The CIO appreciates being looped in early. *'Good catch \u2014 let's keep intake as primary, but spend two extra discovery interviews understanding scheduling before we lock scope. Don't commit to building anything yet.'* You now have a clear, sponsor-approved discovery boundary.",
      "decision": {
        "prompt": "How do you use the two extra interview slots?",
        "options": [
          {
            "id": "A",
            "text": "Interview two more scheduling staff at different clinic locations, to see if the double-booking issue is consistent or location-specific.",
            "isCorrect": true,
            "feedback": "Smart \u2014 you're testing whether this is a systemic issue or a local anomaly before it shapes the project.",
            "stateChanges": {
              "projectHealth": 2
            },
            "nextScene": "s03_data_landscape"
          },
          {
            "id": "B",
            "text": "Interview the CIO again, since she's the sponsor and her opinion matters most.",
            "isCorrect": false,
            "feedback": "The CIO already gave her view. You need operational evidence now, not more executive opinion.",
            "stateChanges": {
              "projectHealth": -2
            },
            "nextScene": "s03_data_landscape"
          }
        ]
      },
      "explanation": "**Once a scoping boundary is approved, the BA's job is to gather the evidence that will inform the actual scoping decision** \u2014 which means going back to the operational level, not re-confirming what the sponsor already said. Talking to staff at multiple locations tests whether the pain point is organization-wide (likely worth addressing) or isolated (likely not worth this project's scope)."
    },
    {
      "id": "s03_data_landscape",
      "domainId": "d1",
      "narrative": "Your follow-up interviews confirm: double-booking happens at 4 of 5 clinic locations, roughly 3-5 times a week each. You also discover something else: patient contact data lives in three different systems \u2014 the EHR, an old scheduling tool, and a paper sign-in sheet at two locations that's never digitized at all.",
      "decision": {
        "prompt": "How do you handle this data fragmentation finding?",
        "options": [
          {
            "id": "A",
            "text": "Document it as a significant constraint that will affect solution design and scope complexity, and flag it clearly in your discovery summary for the CIO.",
            "isCorrect": true,
            "feedback": "Correct \u2014 this is exactly the kind of finding that should shape scope and timeline conversations, not get buried in a footnote.",
            "stateChanges": {
              "projectHealth": 2
            },
            "nextScene": "s04_problem_statement"
          },
          {
            "id": "B",
            "text": "Recommend immediately that all three systems be replaced by Salesforce before any further discovery happens.",
            "isCorrect": false,
            "feedback": "This is a major technology recommendation made far too early, without enough analysis to justify it.",
            "stateChanges": {
              "projectHealth": -4,
              "scheduleRisk": 8
            },
            "nextScene": "s04_problem_statement"
          }
        ]
      },